<?xml version="1.0"?>
<accounts xmlns:xsd="http://www.w3.org/2001/XMLSchema-instance" 
    xsd:noNamespaceSchemaLocation="accounts.xsd" >
    <account number="1000">
    	<holder address="Corso Grosseto, 25" name="Gianfranco" fiscalID="AA13AA13AA13AA13"/>    	
    	<holder address="Corso Stati Uniti, 101" name="Alberto" fiscalID="CCC179CCC179CCC1"/>
    	<yearOperation year="2019" >
    		<operation date="2019-10-25" amount="500.00">
    			<description>Pagamento affitto</description>
    		</operation>
    	</yearOperation>
    </account>
    <account number="2000">
    	<holder address="Corso Francia, 312" name="Simone" fiscalID="BBBB1234BBBB1234"/>
    	<holder address="Corso Stati Uniti, 101" name="Alberto" fiscalID="CCC179CCC179CCC1"/>
    	<yearOperation year="2019">
    		<operation date="2019-05-13" amount="219.99"/>
    		<operation date="2019-05-13" amount="69.13">
    			<description>Bolletta</description>
   			</operation>
    	</yearOperation>
    	<yearOperation year="2018">
    		<operation date="2018-05-13" amount="219.99"/>
    		<operation date="2018-05-13" amount="69.13"/>
    		<operation date="2018-01-25" amount="100.00"/>
    	</yearOperation>
    </account>
    <account number="3000">
    	<holder address="Corso Unione Sovietica, 666" name="Valentino" fiscalID="DD66FF99DD66FF99"/>
    	<yearOperation year="1997">
    		<operation date="1997-10-12" amount="300000">
    			<description>Acquisto lavastoviglie</description>
    		</operation>
    	</yearOperation>
    </account>
</accounts>